Let Alone,Way Manner,Resultative,Conative,Intransitive Motion,Caused Motion,Causative with CxN,Ditransitive CxN,Comparative Correlative ,,Much Less ,,
"There has been little understanding or recognition of the rights of teachers as employees let alone as adults with needs, expectations and aspirations. (FN Construction)","Up the long stone stairs from the kitchen, into the green enclosed light of the pantry passage, then on up the next staircase, its turns mean and sudden compared with the twin sweeps of the main stairs, Nicandra plodded her careful wayto Aunt Tossie 's bedroom door.",I had BRUSHED my hair very smooth. (Goldberg),He pushed at the doorbell. (COCA),"Residents near the epicenter in Papua province rushed from their homes in search of higher ground shortly after the first 7.6-magnitude quake struck, afraid that huge waves might WASH over the island. (AMR)","`` From the time that skeletons were CARRIED through the streets of Calanda during the Holy Week procession , death has been an integral part of my life . (AMR)","He filled his mouth with an impossibly large handful, then studied me, crunching. (COCA)",Wikis PROVIDE students an authentic experience applying their information skills . (COCA),"The more you earn, the more you spend, the more sales tax youy pay comppared to someone who earns less and thus spends less. (AMR)",,"And most of my students had never been to America, much less an American newsroom. (COCA)",,
"Opportunities for specialists in an information-based business organization should be more plentiful than they are in an orchestra or hospital, let alone in the Indian civil service. (FN Construction)",A middle-aged man eased his way into the room.,You KILLED it stone-dead. (Goldberg) ,"Panting with adrenaline, the men pushed at the dragons with their forked sticks. (COCA)","The man will come to her home at night, SNEAKING in through her window (it is also a part of the Mosuo culture that, while everyone knows this is happening, it should be done in a manner that is not obvious), spending the night, and then leaving early the next morning before everyone wakes up. (AMR)",The MiG-25 FIRED an AAM at the Predator. (AMR),"The school filled his head with knowledge, challenged him with tests, quizzes, and homework. (COCA)","The women in the course TOLD me several such "" stories "" they had heard about the state treatment of pious Muslims . (COCA)",The more you you gain of one the more you lose of the other and the simple fact is liberals value security more than freedom. (AMR),,How could Obama be leading over an empty chair much less a succesful businessman who by all accounts seems squeaky clean and extremly honest. (COCA),,
"And to think, he wrote, that with all my previous work I barely knew what step to take first, let alone what step to take second, let us not talk about the third. (FN Construction)","Like an overgrown Bisto kid I sniffed and aaahed my way to the source of the oaky-smokey smell, where I met a man whom I am very pleased to know.","I charged with them, and got KNOCKED silly for my pains. (Goldberg) ","I took a washcloth and wet it, then rubbed at the mark. (COCA)","But of course I expected everyone to jump up and try to claim that I was comparing Glenn Beck to the Hitler everyone knows as the dictator who MARCHED across Europe and planned the Final Solution, while I was merely pointing out that if people don't have facts and will ONLY listen to propaganda, they WILL BE drawn to a charismatic personality. (AMR)","Workers DUMPED large burlap sacks of the imported material into a huge bin , poured in cotton and acetate fibers and mechanically mixed the dry fibers in a process used to make filters . (AMR)","Susan trapped him, filled his head with lies. (COCA)",The new regulatory structure PERMITTED commercial banks many of the same powers as brokerages and investment bankers . (COCA),"I thought the Rio Grande was often dry--and that the wetter it was, the lower the levels of smuggling both animate and inanimate contraband. (AMR)",,So Fitzgerald structured this case so as to avoid mentioning -- much less admitting -- that at its root lies a bunch of men guilty of torture. (COCA),,
"Like any self-respecting academics, the Brookings authors do not agree on what the problem is, let alone how to cure it. (FN Construction)","The vet was forced into an unscheduled arrival at 50 miles-an-hour into a nearby farm-yard, much to the surprise of a herd of Jerseys ambling their way to the milking parlour.",The tools were WIPED clean. (Goldberg) ,He rubbed at the raw bite wound on his throat. (COCA),In VERY vivid detail I remember FALLING down the first flight of stairs in my house onto the landing in front of the main door. (AMR),"When the CIA suspects people of connections to terrorism, it SNATCHES them off the streets wherever they live, flies them to those secret prisons, and interrogates them. (AMR)","They made him take pills that filled his head with cold, silent noise. (COCA)",The extraordinary teacher-salary increases BOUGHT Bloomberg the union 's blessing for extending the mayoral-control law in the state legislature in the summer of 2009 . (COCA),"Yeah, the more I think about it, the more I believe that not only did Paterno fail miserably at handling the case, but he was possibly completely aware of what was going but was just protecting his buddy. (AMR)",,"But, once you go down that path, you never want to jump much less see another broom in your entire life. (COCA)",,
"At this lowest level of British industry it is almost as though struggles are not expected to occur, let alone be won. (FN Construction)",I yawned my way back to the Narrow Neck.,The river FROZE solid. (Goldberg) ,He rubbed at the mark and shook his head. (COCA),"People who SPILLED over from the ""protest"" attacked their car as it went down Regent Street. (AMR)","some of this is fair (state was all but ignored in 2003), some of this is not (bureaucratic irritation at the initiatives KICKING them out of comfortable perches and into WoT hotspots). (AMR)"," Early on, his parents filled his head with thoughts of scholarly achievement. (COCA)",Apparel design faculty TEACH students fashion with eyes on the global garment-making network and the diverse cultural influences driving modern styles. (COCA),"Ever notice that the more gridlock there is, the more Congress' ratings go down. (AMR)",,"They shouldn't let people like that have kids, much less bring them out in public. (COCA)",,
"But I also realized that I would be exceedingly lucky to keep my existing road and rail budgets, let alone add massive new expenditure. (FN Construction)","Their legs entwined, like some exotic two-headed carnival monster in skin-tight red, yellow and blue costumes, the limbo dancers were gyrating their way skilfully beneath a burning pole.",It BROKE apart. (Goldberg),I rubbed at the ache in my neck. (COCA),"Marchers will PROCEED on Pine St. to Broadway, to Market. (AMR)","My plan is to migrate all of my media (probably about 700 DVDs and BDs, counting all the TV shows I have) onto the server over the next year or so, and BANISH the hardcopy to a closet for backup. (AMR)",She's also covered her body with tattoos. (COCA),"The feat WON Mr. Broockman and Mr. Kalla instant fame in the research world , but at a cost . (COCA)","The longer this goes on, the more likely an Obama victory will be. (AMR)",,"I believe with all my heart that those Christians who condone, much less support this great evil will face judgment in the hereafter. (COCA)",,
"The old Herring and Addis tools were made with a finesse and temper that modern tools do not approach, let alone equal. (FN Construction)","Though punctuated by frequent flash-backs to the period before, during and just after the war, temporal progression in the present is clearly marked by the development of two narrative lines which weave their ways in and out of the novel.","Whose whole life is to EAT, and DRINK, and LAUGH themselves fat. (Goldberg)",She plucked at the orange shag strands beneath the bottle tops. (COCA),"Thousands of mine workers and supporters plan to MARCH around the headquarters of Peabody Energy in St. Louis this coming Tuesday, Sept. 24th. (AMR)","Iran in retaliation would LAUNCH its long range missiles at Israel, as well as encouraging Hezbollah to harass Israel. (AMR)",One of the teachers came along and covered her body with a black sheet. (COCA),The US Constitution AFFORDS me rights as a citizen . (COCA),"But the longer this goes on, the worse his odds get. (AMR)",,"she probably should not EVER have disclosed that information to ANYONE, much less to people who could arguably be considered' strangers' on the internet (COCA)",,
"How many modern Prime Ministers could recall such exploits in their past, let alone dare to boast about them? (FN Construction)","They crossed the strip of wasteland underneath the motorway link that came tunnelling and bridging its way through the hilly landscape, and entered a zone of fenced-off lots containing warehouses and sales-rooms, light industrial units and the offices of small businesses.",The dog would BITE us all mad. (Goldberg),Her fingers plucked at the air in movements as regular as the ticks of a metronome. (COCA),"But it happened that after WALKING for a long time through sand , and rocks , and snow , the little prince at last came upon a road . (AMR)","Why aren't they ashamed that in an age when we are LAUNCHING satellites into space, we have yet to conquer a medieval disease like plague."" (AMR)","John, the blacksmith, had found her about a mile down the road and covered her body with a Crocker sack. (COCA)","Harvard Law School OFFERS students more clinical opportunities than any law school in the world , with nearly 30 clinics and hundreds of unique externships across the country .",The fewer things we make the more sustainable we are. (AMR),,"Costello, did you even bother to look at, much less read, the second page of the article? (COCA)",,
"Contrary to what folk models of the RUC might lead one to expect, most policemen and women at Easton have not even drawn their gun, let alone fired it. (FN Construction)",HOO HAH BOYS : A strange tribe of people from the south of Ireland who have no interest in the concept of life as we know it but instead tend to live out their winters bushing it (See : BUSHING) behind the Carlini factory and spend their summers drinking their way across Europe.,She LAUGHED herself crooked. (Goldberg),Lily plucked at the ribbons on her dress. (COCA),"But , at the noise I made , the snake let himself FLOW easily across the sand like the dying spray of a fountain , and , in no apparent hurry , disappeared , with a light metallic sound , among the stones . (AMR)","They should be very worried about this item, I believe Putin is slowly SLIDING Russia back to what it once was. (AMR)","Seay jumped to his feet, grabbed her and covered her body with his as the bullets hit him. (COCA)",I SENT him money .,"At age 56, the more I think about it and the madder I get, to hell with the SC rulings. (AMR)",,"There is little understanding, much less acceptance, of the cooperative principle and its potential. (COCA)",,
"Most of my friends haven't been outside Australia, let alone been all over the world. (FN Construction)","Poor Rob, what is he going to do with this middle-aged bat who is sobbing her way down the Thames?",He HAMMERED the metal flat. (Goldberg),She plucked at the sheet with one hand then smoothed it. (COCA),"He was beginning to be afraid he had come to the wrong planet , when a coil of gold , the color of the moonlight , FLASHED across the sand . (AMR)","As helicopters CARRIED emergency crews to the scene of the disaster nearly 100 Americans headed home to military bases in Germany, without eight members of their ski clubs who never came back. (AMR)",The idea of everyone writing a letter for their dad filled her heart with possibility. (COCA),"They SENT him a bill for $4,000","The further down that slope we go, the harder it is to pull back. (AMR)",,"No one mentioned abortion, much less birth control, although folks did sometimes sit through an extended sermon on tolerance (COCA)",,
"In Southall now, particularly since the murder in summer 1976 of a young man, Gurdeep Singh Chaggar, by racist thugs, few Asian adults even think about integration, let alone want it. (FN Construction)","Wearing a woollen pixie hat above his bright red beard, he loudly and uninterruptedly belched and farted his way up and down Moel Hebog with a cheery smile and complete disregard for the appalled looks which followed his thundering progress",He CRIED himself asleep. (Goldberg),He stabbed at the last part of the equation. (COCA) ,I RAN around the track. (AMR),Mealman works in construction and DROVE his 16-foot trailer to the area to help people salvage what they can from their homes. (AMR),She filled her heart with the most useful and sweet sayings of Sacred Scripture. (COCA),they OWE me a free heart transplant .,"Bill, the more I read your stuff, the more I am convinced that you have a black heart. (AMR)",,"several other pitiful fools in this thread have NO concept of Truth, much less bravery or intelligence.....(COCA)",,
"Mrs Parvis gave no sign of being interested in her, let alone liking her enough to want to touch her. (FN Construction)","Rather than trying to bluff your way through, it is better to say something like , 'Right at this moment it's rather difficult to remember the exact details, could I possibly look over the advertisement again?",He TALKED himself blue in the face. (Goldberg),I took the plastic dome from my drink and stabbed at the slush with the straw. (COCA),I DROVE through the tunnel. (AMR),"Pope was FLOWN to the U.S. military base at Ramstein, Germany. (AMR)",he gave her life a new meaning and filled her heart with joy. (COCA),Dissent BROUGHT us FDIC insurance ( why you did n't lose everything in 2008 ) when Huey Long filibustered the banking reforms of 1933 adding it in the legislative package thus bringing 50 years of financial stability .,"I thought about taking Phoneix's advice and turning my thoughts into a letter to the editor or a ""My Turn"" essay for Newsweek or something but the more I read the more I realized that the amount of research required is beyond me. (AMR)",,"This person has never even heard of a septic tank, much less wastewater treatment plants, eh? (COCA)",,
"It takes science to come along and tell us that what is going on under these circumstances is a brain process, let alone to tell us which brain process it is. (FN Construction)",It was an easy matter to buy my way on to the same flight.,The joggers RAN the pavement thin. (Goldberg),Then he reached out and stabbed at the rat's hind leg. (COCA),We DROVE past the hotel. (AMR),But he is swiftly DRAWN into a tangle of memories about a less newsworthy and more exotic part of Peru: its corner of the Amazon jungle. (AMR),"I, the bargain hunter who' d filled her house with yard sale castoffs, I with my rough hands and untended nails (COCA)","The district court judge in Colorado AWARDED the company $4,543 in costs , despite the absence of a finding that Marx had brought the case "" in bad faith and for the purpose of harassment . (COCA)",""" The higher up the nicer ! "" (Weissweiler et al) ",,"GOP can't even raise tax revenue on their buddies, the rich, much less the rest of us, and spending on entitlements won't slow anytime soon. (COCA)",,
Most stable-lads would have counted themselves lucky even to get a ride let alone to win a race. (FN Construction),"Groping her way into the sleeves, Nicandra wondered uneasily what these unusual indulgences portended.",The dog BARKED the chickens awake. (Goldberg),Alan's finger stabbed at the button on the flashlight. (COCA),The plane FLEW over the Grand Canyon. (AMR),Anti-drug police on 1 July 2003 also arrested a Lao National named khamkhuong unmano as police broke up a gang TRAFFICKING the psychoactive pharmaceutical bromazepam from Laos to Vietnam. (AMR),"Hanne has filled her house with Pascal: his artwork, his drum set, his will. (COCA)","The Soil Conservation Service TAUGHT farmers really good techniques that are still in practice today -- contour plowing , rotating crops intelligently . (COCA)",She thinks the more water she drinks the better her skin looks . (Weissweiler),,He has not yet been put on trial much less found guilty. (COCA),,
But how soon they could be made into practical let alone commercial devices is anybody's guess. (FN Construction),"He roared and roared, waist-high in the shallows, pushed this way and that by the breakers, his head lofted, air piling into his lungs, as he fought his way towards the granite rockpile.",Terry WIPED the table clean. (Goldberg),"She took the cup and sipped at the coffee, closing her eyes and breathing in the steam. (COCA)",I DRIVE past Watkins Landing every morning and evening . (AMR),Thai government stated in early 2004 that Thai government was considering building a high-security fence along Thailand's border with Myanmar in a bid to stop smugglers TRAFFICKING illegal drugs into Thailand. (AMR),Howze filled her house with music and color (COCA),He PAID you the compliment . (COCA),It becomes an obsession lightly because the more fish you catch the higher your adrenaline flows . (Weissweiler),,"And... there's no guarantee that you will be loved, much less forever. (COCA)",,
"As though in wonder that any virus, let alone a foreign one, would dare to get up the royal hooter. (FN Construction)","This steam sometimes blasts its way up to the surface through the lava, causing what is known as a phreatic explosion, so the advance of the lava is then anything but peaceful, and unwary spectators are sometimes injured by the explosions.",Terry PUSHED the door shut. (Goldberg) ,I sipped at the Heineken. (COCA),I COMMUTE back and forth to work on the Huguenot Trail . (AMR),"Australian Schapelle Corby was convicted of TRAFFICKING marijuana into Bali and jailed for 20 years. (AMR)
",Photograph Nina filled her house with materials and objects that summon up the spirit of a Provencal barn (COCA),He SHOWED her the slip of paper . (COCA),"It is worth noting , however , that the more specific you are the better . (Weissweiler)",,Many individuals do not have a job or a phone much less an auto or property. (COCA),,
"Not one of the 33 No-voters, let alone the 24 abstainers, was prepared to go on television on Tuesday night to stand by Sir Anthony. (FN Construction)","And as I stood myself alone upon the New Year night, I prayed unto the frosty moon, with her pale light -- what a dull time we should have if we tried to read our way through The Fall of Princes.",He ATE himself sick. (Goldberg),He raised his glass and sipped at the champagne with everyone else. (COCA),"Local resident Beverley Phillips, who fled by car with just her pet poodle and cat, described DRIVING through thick smoke to reach safety. (AMR)",The Pakistan-born man was then DEPORTED to the United Kingdom on 070713. (AMR),she'd purposely filled her life with things other than romance for three years straight. (COCA),"Every Zimmer and Motel we went to REFUSED us a bed for the night , including a place called Zorba 's , which had been recommended in our guidebook as particularly friendly to Americans . (COCA)","In other words , the more videos you make the greater your audience reach . (Weissweiler)",,"it gets harder and harder to keep up with new shows, much less the all-time classics.  (COCA)",,
Benn is too much a product of his comfortable and intensely high-minded background to be able to understand why the common man let alone the common politician has more vulgar aspirations than plain living and high thinking. (FN Construction),But Mum just gave them one of her black looks and elbowed her way past the two women and went into Granny's house.,She COUGHED herself sick. (Goldberg) ,Jake sipped at the jug and didn't answer. (COCA),"The misfortune Monday ``was not that it was just a large tornado, but that it lasted a long time and PASSED through a populated area,'' he said. (AMR)",The pilot refused to ALLOW the Pakistan-born man onto the pilot's plane. (AMR),She's close to her 18- year-old son and she's filled her life with projects she finds personally rewarding. (COCA),He BUYS her a bag of anise-flavored candies from the kiosk inside the Egyptian spice market . (COCA),"The more we get together, the happier we'll be (Hoffman, Brunner & Horsch)",,"he can not find a job, much less one in his engineering field. (COCA)",,
"Promises of a new bullet train here, a relief road there, let alone an airport or large tourist attraction, are clearly likely to favour the ruling party in dozens of marginal constituencies. (FN Construction)",Constance squeezed her way down the platform looking for the first-class carriages.,She SLEPT herself sober. (Goldberg) ,Phil nibbled at the cake. (COCA),"The tornado that ADVANCED through southern Oklahoma City and Moore cut a 40-mile swath across the middle of the state, leaving concrete slabs where homes had been. (AMR)",Thomas Olsson stated that the lawyers for Al-Barakaat International would now examine ways of having the assets RELEASED to the Somali immigrants in Sweden who used the network to send funds to relatives in Somalia. (AMR),Martin dabbed her lips with poppy paste. (COCA),"Forgiveness allows us freedom from resentment , judgement , and hatred . (COCA)","The more that he says, the less I wanna say. (Hoffman, Brunner & Horsch)",,"you don't have the perspective, much less the right, to judge them for being in that hole. (COCA)",,
"You'd have trouble swinging a gerbil, let alone a cat, in the kitchen. (FN Construction)",He did not sound a bit sorry and she almost smiled because she had forgotten how Charles bulldozed his way through life.,The jackhammer POUNDED us deaf. (Goldberg),"Cows nibbled at the roots, goats at the tips. (COCA)","Dade County and federal authorities, learning that he intended to FLY through Miami, made plans to arrest him on the gun-running charges as soon as he hit U.S. soil. (AMR)",Mexican football club owner and 4 team members are charged with TRAFFICKING cocaine and marijuana from Colombia to the United States. (AMR),The cork came out with a pleasant pop and he filled her glass with the rich red liquid. (COCA),"We GRUDGE you nothing , for we have now no use for it . (COCA)","The more they work, the more I will pay them. (Hoffman, Brunner & Horsch)",,"we would not have been able to keep fighting, much less win. (COCA)",,
"Beecher's reputation as a preacher, let alone as a Man of God, was not universally accepted. (FN Construction)","He chewed his way through a large and over-greasy midday meal, drank more beer than he ought to have done, took some laudanum with his brandy and water to give him sleep and felt his brain ripped open by a nightmare which wolfed down his mind in the open bleeding mouths of women.",The alarm clock TICKED the baby awake. (Goldberg) ,"He nibbled at the filet, then ate ravenously. (COCA)","Oguz said that anyone FLYING over the major opium producing areas would see a lot of small fires in the mountains, which are heroin labs. (AMR)","China confirmed on January 23, 2007 after 12 days of silence that China had FIRED a guided missile into space to destroy one of its satellites. (AMR)",The waiter filled her glass with white wine. (COCA),She TOLD me a story about dining with the Dean of Students at a welcoming banquet for exchange students . (COCA),"The more snow, the less danger there is to skiers. (Hoffman, Brunner & Horsch)",,"She never owned a microwave oven, much less a computer. (COCA)",,
"Perhaps more fundamental than this was the criticism he received from a Methodist minister that the book does not really mention, let alone do justice to, the central Christian doctrine of Justification by Faith. (FN Construction)","Those Roebuck penalties apart, the only other scores from the Australians came in the first half, when strapping winger Damien Smith barged his way through two tackles to notch the game's only try.",Water FILLED the tub half full. (Goldberg),"The boy frowned, but then he nibbled at the edge of the spoon and finally swallowed the whole amount. (COCA)","Each year , over 50,000 migratory birds FLY over Hong Kong 's skyscrapers and choose to roost for winter here . (AMR)","Chinese officials stated on May 14, 2007 that China had LAUNCHED a Chinese manufactured communications satellite into orbit on behalf of Nigeria. (AMR)","Twenty-some years later, sunk in depression, my friend filled her pockets with rocks and paddled a canoe out to the middle of a lake and capsized (COCA)",My ex FEEDS my kids cheese whiz and R.C. Cola . (COCA),"The more of them you see, the cheaper it is. (Hoffman, Brunner & Horsch)",,"Hostess wouldn't have gone into bankruptcy in 2004, much less today. (COCA)",,
"The Protestant majority in Ulster totally refused to acknowledge, let alone operate, the Hillsborough Agreement. (FN Construction)",With the ball inches from the line hooker Sean Culleton burrowed his way under the bodies for an unconverted try.,The sleeping pills MADE me sick. (Goldberg),"Sloan brushed at the tears on her own cheeks, and replied, ""Neither have I."" (COCA)",But it's all FLYING right over your head. (AMR),"""I'm being PAROLED to my father in heaven,"" Biros said. (AMR)",Virginia Woolf filled her pockets with rocks and walked into a river.  (COCA),My mom BOUGHT me these skates . (COCA),"The longer the rain lasted, the more quickly the ramparts melted. (Hoffman, Brunner & Horsch)",,He would never play second fiddle to someone like Willard much less take his marching orders from the likes of the tea party. (COCA),,
