Let Alone,Way Manner,Resultative,Conative,Intransitive Motion,Caused Motion,Causative with CxN,Ditransitive CxN,Comparative Correlative ,,Much Less ,,
"The director-general, Michael Checkland, once publicly reprimanded The Late Show's producers, reminding them that most licence-fee payers had never heard of -- let alone visited -- the Groucho Club. (FN Construction)","He felt his way across the joists in front of him, got his legs free from the cupboard and was able to get up into a crouch, balancing on a joist, hands just above his head, holding on to rough, undressed wood.",Harry SHOT Sam dead. (Goldberg),"He kissed her in return, then brushed at the lipstick he knew she had left behind. (COCA)",I'll bet the email lies are FLYING back and forth. (AMR),Australia is increasingly targeted by asylum seekers from the Middle East and Asia who often fly to Indonesia then pay people smugglers to SHIP them in rickety boats to Australian islands in the Indian Ocean. (AMR),She filled her pockets with the smooth whorled brown nuts. (COCA),"The day before they left the nation 's capital , with its few scattered impressive buildings , indifferent hotels , infamous boarding houses , PROVIDED Mason his sign . (COCA)","The more successful we are, the more we'll attract competition. (Hoffman, Brunner & Horsch)",,And what potential convert could understand much less follow such conflicting and jumbled messages? (COCA),,
"The disadvantage was that 'the liberal bridle-path' could be seen, let alone followed, only by liberals. (FN Construction)","He punched his way through, tearing an opening in what must have been the thing's gut (for sinuous tubes were visible there, coils of transparent rubber that could only have been intestines).",Sam TALKED himself hoarse. (Goldberg) ,"He studied her face, brushed at the hair that tumbled over her shoulders. (COCA)","It will be like you're FLOATING along fine, then in an instant, you are caught up in this huge swell of the urge to smoke. (AMR)",Increased levels of IL-1 in IBD may be result of stimulation of colonic macrophages that can activate interleukin (IL)-1 converting enzyme (ICE) and hence RELEASE mature IL-1beta into the colonic mucosa[20]. (AMR),A blizzard soon covered their bodies with snow. (COCA),they THREW me a surprise party . (COCA),"The sooner it is tested, the better. (Hoffman, Brunner & Horsch)",,"This because Anons are not looking for personal credit, much less looking to be rock stars. (COCA)",,
"Where Musgrove and John Hopkins, who put it all together, got lucky was that they chronicled a period of success that may never have been equalled, let alone exceeded, by any British golfer. (FN Construction)",The practical man thought his way through these apparent obstacles.,He DROVE her bananas. (Goldberg),Dolly brushed at the skirt of her ample black cashmere suit. (COCA),"Just PASSING through, taking a look (AMR)","It has been found that KSR is bound directly to MEK in the cytoplasm of quiescent cells; upon activation of the MAPK pathway by growth factors or activated RAS, KSR is RELOCALIZED to the plasma membrane in a complex containing RAF, MEK, and MAPK ( M ICHAUD et al. 1997 ; D ENOUEL-GALY et al. 1998 ; (AMR)",Two of the loincloth-clad singers had covered their bodies with traditional clay and paint designs (COCA),"She BRINGS Beth food , peanut butter and marshmallow fluff sandwiches , which is something her mother never makes . (COCA)","The denser the matter, the more curvature. (Hoffman, Brunner & Horsch)",,"we did not see a single boat on our three dives, much less any other divers. (COCA)",,
"However, its role in influencing these rhythms -- let alone actually being responsible for them -- is not at all established. (FN Construction)","Slick sophistication is only too evident in the glittering Nevada oasis of Las Vegas, while the dry desertland of Arizona houses the gargantuan Grand Canyon, where the Colorado River winds its perilous way through the sheer plunging walls of rock.",He TICKLED her silly. (Goldberg) ,It hammered at the two figures riding south along Canandaigua Road. (COCA),"He's staying in a hostel and will be HEADING southwards on Tuesday (December 7), heading roughly in the direction of Spain across the Pyrennees. (AMR)","I wish we viewed it as a disease and as an opportunity to help people, rather than an opportunity to THROW someone in jail. (AMR)",the shows were often performed by White men who blackened their faces with burnt cork. (COCA),"She TOSSED him first his shirt , then his jeans and briefs . (COCA)","The more information requested, the longer it will take to review. (Hoffman, Brunner & Horsch)",,"The truth is, we can't project the climate of the next decade, much less that of the next century. (COCA)",,
"The first membranes they made were far too thin and would not survive transfer into air, let alone freeze-drying. (FN Construction)","The Whaddon and Mitchley Scouts and Guides band wound its tuneless way along the High Street, followed by six young girls lethally wielding pom-poms -- the Mentle Motors Majorettes -- and bringing up the rear, Reg Pybus ' Bedford minibus in which, crammed like sardines, the new team sat invisible behind the heavily steamed up windows.",It RENDERED them impotent. (Goldberg) ,Someone hammered at the front door. (COCA),The law will probably JUMP back and forth in the coming years. (AMR),"In 1943, the interned Rev. Isobe was DEPORTED to Japan, forcing officers to call a special meeting on July 21, 1945 to decide the fate of the shrine. (AMR)","Everybody, old and young, male and female, decorated their hair with scarlet and yellow hibiscus flowers. (COCA)",Cat HANDED Adams the disc . (COCA),"The more data, the more information. (Hoffman, Brunner & Horsch)",," Consequently I wouldn't vote for a republican to be assistant bathroom attendent, much less President of the United States. (COCA)",,
"Then no-one would have been satisfied, let alone the person who is the victim in all this. (FN Construction)","Jet-cloud interactions can generate localized H-H objects in a variety of ways , ranging from the production of internal shocks in the jet to radiation behind the shockwave systems at the front of the jet as [it] {[bores] [<its way>]} [though the surrounding cloud",He PAINTED his house a bright shade of red. (Goldberg),,"Saturday morning, American Marines and British troops RUMBLED along the main road from the Kuwaiti border to Basra, Highway 80, nicknamed the ``Highway of Death'' during the 1991 Gulf War, when U.S. airstrikes wiped out an Iraqi military convoy along it. (AMR)","They want to turn the United States in to a corporation and one surefire way to do it, is for the people's representatives to ABDICATE their responsibilities and power to a dominating CEO/President. (AMR)",,,"The more serious the offence, the more difficult to make peace, the greater the compensation had to be. (Hoffman, Brunner & Horsch)",,,,
,"There's a lot to learn in this path, and I'm still trying to feel my way through. (AMR)",Bees will SUCK themselves tipsy upon varieties like the sops-of-wine. (Goldberg) ,,"Earlier Saturday, Baghdad was again targeted, one day after a massive U.S. aerial bombardment in which more than 300 Tomahawk cruise missiles RAINED down on the capital. (AMR)",,,,"The less elaborate you can be, the better. (Hoffman, Brunner & Horsch)",,,,
,"Known as ""death angel"" for its snow-white appearance, the fungus has deadly toxins that worked their way through Crippa's system, sickening him and eventually causing his liver to fail. (AMR)",Till he had DRUNK himself sleepy. (Goldberg),,Army forces ROLLED past dozens of dead Iraqi soldiers and bombed-out hulks of Iraqi military equipment as they made their way toward Baghdad from the area around Karbala. (AMR),,,,"Now then, the faster that we can do this, the faster we can get on with the game. (Hoffman, Brunner & Horsch)",,,,
,"Large, slow-moving air transport carriers like the CH-47 Chinook are particularly vulnerable, often forced to EASE their way through sheer valleys where insurgents can achieve more level lines of fire from mountainsides. (AMR)",It's the stale loaf I put out for the birds and they've PECKED it really pretty. (Goldberg) ,,I only do it after a shave because otherwise the facial hair stops it from melting into the skin properly. (AMR),,,,"The more expensive the decision, the more will senior management be involved. (Hoffman, Brunner & Horsch)",,,,
,"That ""absurdity with absurdity"" shit is a smoke screen that he uses to try to SNAKE his way out of the fucked up things that he says. (AMR)",She KICKED the door open. (Goldberg) ,,"""Under these conditions fires can be difficult to control and flames may BURN from the ground to the tree-tops."" (AMR)",,,,,,,,
,,,,The 23 frantically SCRAMBLED to the rear of the sub. (AMR),,,,,,,,
51,55,55,50,IRNA reported that Gomshadzehi killed a policeman and then ESCAPED to Dubai in the United Arab Emirates while trafficking drugs in 2003. (AMR),,,,,,,,
,,,,Armed troops MARCHED to the substations and turned the power back on. (AMR),,,,,,,,
,,,,,,,,,,,,
51,55,55,50,58,51,50,50,54,,50,524,TOTAL CONSTRUCTS